,sentence,word_labels
5,"Based on the model , a music scene analysis system has been developed for acoustic signals of ensemble music , which recognizes rhythm , chords , and source - separated musical notes .","O,O,O,B,O,O,B,I,I,I,O,O,O,O,B,I,I,I,I,O,O,O,B,O,B,O,O,B,I,I,I,I,O"
6,"Experimental results show that our method has permitted autonomous , stable and effective information integration to construct the internal model of hierarchical perceptual sounds .","O,O,O,O,O,B,O,O,O,O,O,O,O,B,I,O,O,O,B,I,O,B,I,I,O"
0,"In this paper , a discrimination and robustness oriented adaptive learning procedure is proposed to deal with the task of syntactic ambiguity resolution .","O,O,O,O,O,O,O,O,O,B,I,I,O,O,O,O,O,O,O,O,B,I,I,O"
1,"Owing to the problem of insufficient training data and approximation error introduced by the language model , traditional statistical approaches , which resolve ambiguities by indirectly and implicitly using maximum likelihood method , fail to achieve high performance in real applications .","O,O,O,O,O,B,I,I,O,B,I,O,O,O,B,I,O,O,B,I,O,O,O,B,O,O,O,O,O,B,I,I,O,O,O,O,O,O,O,O,O,O"
2,The proposed method remedies these problems by adjusting the parameters to maximize the accuracy rate directly .,"O,O,B,O,O,B,O,O,O,O,O,O,O,O,O,O,O"
3,"To make the proposed algorithm robust , the possible variations between the training corpus and the real tasks are also taken into consideration by enlarging the separation margin between the correct candidate and its competing members .","O,O,O,O,B,O,O,O,O,O,O,O,O,O,O,O,O,O,O,O,O,O,O,O,O,O,B,I,O,O,O,O,O,O,O,O,O"
4,Significant improvement has been observed in the test .,"O,O,O,O,O,O,O,O,O"
5,The accuracy rate of syntactic disambiguation is raised from 46.0 % to 60.62 % by using this novel approach .,"O,B,I,O,B,I,O,O,O,O,O,O,O,O,O,O,O,O,B,O"
0,Graph - cuts optimization is prevalent in vision and graphics problems .,"B,I,I,I,O,O,O,B,I,I,I,O"
1,It is thus of great practical importance to parallelize the graph - cuts optimization using to - day 's ubiquitous multi - core machines .,"O,O,O,O,O,O,O,O,O,O,B,I,I,I,O,O,O,O,O,O,B,I,I,I,O"
2,"However , the current best serial algorithm by Boykov and Kolmogorov [ 4 ] ( called the BK algorithm ) still has the superior empirical performance .","O,O,O,O,O,B,I,O,O,O,O,O,O,O,O,O,O,B,I,O,O,O,O,O,O,O,O"
3,It is non - trivial to parallelize as expensive synchronization overhead easily offsets the advantage of parallelism .,"O,O,O,O,O,O,O,O,O,B,I,O,O,O,O,O,B,O"
4,"In this paper , we propose a novel adaptive bottom - up approach to parallelize the BK algorithm .","O,O,O,O,O,O,O,O,B,I,I,I,I,O,O,O,B,I,O"
5,"We first uniformly partition the graph into a number of regularly - shaped dis - joint subgraphs and process them in parallel , then we incre - mentally merge the subgraphs in an adaptive way to obtain the global optimum .","O,O,O,O,O,B,O,O,O,O,B,I,I,I,I,I,I,O,O,B,O,O,O,O,O,O,O,O,O,O,B,O,O,O,O,O,O,O,B,I,O"
6,The new algorithm has three benefits : 1 ) it is more cache - friendly within smaller subgraphs ; 2 ) it keeps balanced workloads among computing cores ; 3 ) it causes little overhead and is adaptable to the number of available cores .,"O,O,B,O,O,O,O,O,O,O,O,O,O,O,O,O,O,B,O,O,O,O,O,B,I,O,O,O,O,O,O,O,O,O,B,O,O,O,O,O,O,O,O,O,O"
7,Extensive experiments in common applications such as 2D/3D image segmentations and 3D surface fitting demonstrate the effectiveness of our approach .,"O,O,O,O,B,O,O,B,I,I,O,B,I,I,O,O,O,O,O,B,O"
0,"Currently several grammatical formalisms converge towards being declarative and towards utilizing context - free phrase - structure grammar as a backbone , e.g.","O,O,B,I,O,O,O,O,O,O,O,B,I,I,I,I,I,I,O,O,O,O,O"
1,LFG and PATR - II .,"B,O,B,I,I,O"
2,Typically the processing of these formalisms is organized within a chart - parsing framework .,"O,O,O,O,O,B,O,O,O,O,B,I,I,I,O"
3,The declarative character of the formalisms makes it important to decide upon an overall optimal control strategy on the part of the processor .,"O,O,O,O,O,B,O,O,O,O,O,O,O,O,B,I,I,O,O,O,O,O,O,O"
4,"In particular , this brings the rule - invocation strategy into critical focus : to gain maximal processing efficiency , one has to determine the best way of putting the rules to use .","O,O,O,O,O,O,B,I,I,I,O,O,O,O,O,O,O,O,O,O,O,O,O,O,O,O,O,O,O,O,B,O,O,O"
5,The aim of this paper is to provide a survey and a practical comparison of fundamental rule - invocation strategies within context - free chart parsing .,"O,O,O,O,O,O,O,O,O,O,O,O,O,O,O,O,B,I,I,I,O,B,I,I,I,I,O"
0,We describe a general framework for online multiclass learning based on the notion of hypothesis sharing .,"O,O,O,O,B,O,B,I,I,O,O,O,B,I,I,I,O"
1,In our framework sets of classes are associated with hypotheses .,"O,O,B,O,O,O,O,O,O,O,O"
2,"Thus , all classes within a given set share the same hypothesis .","O,O,O,O,O,O,O,O,O,O,O,O,O"
3,This framework includes as special cases commonly used constructions for multiclass categorization such as allocating a unique hypothesis for each class and allocating a single common hypothesis for all classes .,"O,B,O,O,O,O,O,O,O,O,B,I,O,O,O,O,O,O,O,O,O,O,O,O,O,O,O,O,O,O,O"
4,We generalize the multiclass Perceptron to our framework and derive a unifying mistake bound analysis .,"O,O,O,B,I,O,O,B,O,O,O,B,I,I,I,O"
5,"Our construction naturally extends to settings where the number of classes is not known in advance but , rather , is revealed along the online learning process .","O,O,O,O,O,O,O,O,O,O,O,O,O,O,O,O,O,O,O,O,O,O,O,O,B,I,I,O"
6,We demonstrate the merits of our approach by comparing it to previous methods on both synthetic and natural datasets .,"O,O,O,O,O,O,B,O,O,B,O,O,B,O,O,B,I,I,I,O"
0,"This paper presents a phrase - based statistical machine translation method , based on non - contiguous phrases , i.e.","O,O,O,O,B,I,I,I,I,I,I,O,O,O,B,I,I,I,O,O"
1,phrases with gaps .,"O,O,O,O"
2,A method for producing such phrases from a word - aligned corpora is proposed .,"O,B,O,O,O,B,O,O,B,I,I,I,O,O,O"
3,"A statistical translation model is also presented that deals such phrases , as well as a training method based on the maximization of translation accuracy , as measured with the NIST evaluation metric .","O,B,I,I,O,O,O,O,O,O,B,O,O,O,O,O,B,I,O,O,O,B,I,I,I,O,O,O,O,O,B,I,I,O"
4,Translations are produced by means of a beam - search decoder .,"B,O,O,O,O,O,O,B,I,I,I,O"
5,"Experimental results are presented , that demonstrate how the proposed method allows to better generalize from the training data .","O,O,O,O,O,O,O,O,O,O,B,O,O,O,O,O,O,O,O,O"
0,"This article introduces a bidirectional grammar generation system called feature structure - directed generation , developed for a dialogue translation system .","O,O,O,O,B,I,I,I,O,B,I,I,I,I,O,O,O,O,B,I,I,O"
1,The system utilizes typed feature structures to control the top - down derivation in a declarative way .,"O,B,O,B,I,I,O,O,O,B,I,I,I,O,O,O,O,O"
2,This generation system also uses disjunctive feature structures to reduce the number of copies of the derivation tree .,"O,B,I,O,O,B,I,I,O,O,O,O,O,O,O,O,B,I,O"
3,The grammar for this generator is designed to properly generate the speaker 's intention in a telephone dialogue .,"O,B,O,O,B,O,O,O,O,O,O,B,I,I,O,O,B,I,O"
0,"In this paper , we introduce KAZE features , a novel multiscale 2D feature detection and description algorithm in nonlinear scale spaces .","O,O,O,O,O,O,B,I,O,O,O,B,I,I,I,I,I,I,O,B,I,I,O"
1,Previous approaches detect and describe features at different scale levels by building or approximating the Gaussian scale space of an image .,"O,O,O,O,O,O,O,O,O,O,O,O,O,O,O,B,I,I,O,O,O,O"
2,"However , Gaussian blurring does not respect the natural boundaries of objects and smoothes to the same degree both details and noise , reducing localization accuracy and distinctiveness .","O,O,B,I,O,O,O,O,O,B,I,I,O,O,O,O,O,O,O,O,O,O,O,O,B,I,I,I,O"
3,"In contrast , we detect and describe 2D features in a nonlinear scale space by means of nonlinear diffusion filtering .","O,O,O,O,O,O,O,B,I,O,O,B,I,I,O,O,O,B,I,I,O"
4,"In this way , we can make blurring locally adaptive to the image data , reducing noise but retaining object boundaries , obtaining superior localization accuracy and distinctiviness .","O,O,O,O,O,O,O,O,O,O,O,O,B,I,O,O,O,O,O,B,I,O,O,O,B,I,I,I,O"
5,The nonlinear scale space is built using efficient Additive Operator Splitting ( AOS ) techniques and variable con - ductance diffusion .,"O,B,I,I,O,O,O,O,B,I,I,I,I,I,I,O,B,I,I,I,I,O"
6,We present an extensive evaluation on benchmark datasets and a practical matching application on deformable surfaces .,"O,O,O,O,O,O,B,I,O,O,O,B,I,I,I,I,O"
7,"Even though our features are somewhat more expensive to compute than SURF due to the construction of the nonlinear scale space , but comparable to SIFT , our results reveal a step forward in performance both in detection and description against previous state - of - the - art methods .","O,O,O,B,O,O,O,O,O,O,O,B,O,O,O,O,O,O,B,I,I,O,O,O,O,B,O,O,B,O,O,O,O,O,O,O,O,B,O,B,O,O,B,I,I,I,I,I,I,I,O"
0,Multimodal interfaces require effective parsing and understanding of utterances whose content is distributed across multiple input modes .,"B,I,O,O,B,O,O,O,O,O,O,O,O,O,O,O,O,O"
1,Johnston 1998 presents an approach in which strategies for multimodal integration are stated declaratively using a unification - based grammar that is used by a multidimensional chart parser to compose inputs .,"O,O,O,O,B,O,O,O,O,B,I,O,O,O,O,O,B,I,I,I,O,O,O,O,O,B,I,I,O,O,O,O"
2,"This approach is highly expressive and supports a broad class of interfaces , but offers only limited potential for mutual compensation among the input modes , is subject to significant concerns in terms of computational complexity , and complicates selection among alternative multimodal interpretations of the input .","O,B,O,O,O,O,O,O,O,O,O,B,O,O,O,O,O,O,O,O,O,O,O,O,O,O,O,O,O,O,O,O,O,O,B,I,O,O,O,O,O,O,O,O,O,O,O,O"
3,"In this paper , we present an alternative approach in which multimodal parsing and understanding are achieved using a weighted finite - state device which takes speech and gesture streams as inputs and outputs their joint interpretation .","O,O,O,O,O,O,O,O,B,O,O,B,I,I,I,O,O,O,O,B,I,I,I,I,O,O,B,I,I,I,O,O,O,O,O,O,O,O"
4,"This approach is significantly more efficient , enables tight - coupling of multimodal understanding with speech recognition , and provides a general probabilistic framework for multimodal ambiguity resolution .","O,B,O,O,O,O,O,O,O,O,O,O,B,I,O,B,I,O,O,O,O,O,O,O,O,B,I,I,O"
0,A domain independent model is proposed for the automated interpretation of nominal compounds in English .,"O,B,I,I,O,O,O,O,B,I,I,B,I,O,B,O"
1,This model is meant to account for productive rules of interpretation which are inferred from the morpho - syntactic and semantic characteristics of the nominal constituents .,"O,B,O,O,O,O,O,B,I,I,I,O,O,O,O,O,B,I,I,I,I,I,O,O,B,I,O"
2,"In particular , we make extensive use of Pustejovsky 's principles concerning the predicative information associated with nominals .","O,O,O,O,O,O,O,O,B,I,I,O,O,B,I,O,O,B,O"
3,We argue that it is necessary to draw a line between generalizable semantic principles and domain - specific semantic information .,"O,O,O,O,O,O,O,O,O,O,O,B,I,I,O,B,I,I,I,I,O"
4,"We explain this distinction and we show how this model may be applied to the interpretation of compounds in real texts , provided that complementary semantic information are retrieved .","O,O,O,O,O,O,O,O,O,B,O,O,O,O,O,B,I,I,O,O,O,O,O,O,O,B,I,O,O,O"
0,"In this work , we present a technique for robust estimation , which by explicitly incorporating the inherent uncertainty of the estimation procedure , results in a more efficient robust estimation algorithm .","O,O,O,O,O,O,O,B,O,B,I,O,O,O,O,O,O,B,I,I,I,I,I,O,O,O,O,O,B,I,I,I,O"
1,"In addition , we build on recent work in randomized model verification , and use this to characterize the ' non - randomness ' of a solution .","O,O,O,O,O,O,O,O,O,B,I,I,O,O,O,B,O,O,O,O,O,O,O,O,O,O,O,O"
2,"The combination of these two strategies results in a robust estimation procedure that provides a significant speed - up over existing RANSAC techniques , while requiring no prior information to guide the sampling process .","O,O,O,O,O,B,O,O,O,B,I,I,O,O,O,O,O,O,O,O,O,B,I,O,O,O,O,B,I,O,O,O,B,I,O"
3,"In particular , our algorithm requires , on average , 3 - 10 times fewer samples than standard RANSAC , which is in close agreement with theoretical predictions .","O,O,O,O,B,O,O,O,O,O,O,O,O,O,O,O,O,O,B,O,O,O,O,O,O,O,B,I,O"
4,The efficiency of the algorithm is demonstrated on a selection of geometric estimation problems .,"O,O,O,O,B,O,O,O,O,O,O,B,I,I,O"
0,"This report describes Paul , a computer text generation system designed to create cohesive text through the use of lexical substitutions .","O,O,O,B,O,O,B,I,I,I,O,O,O,B,I,O,O,O,O,B,I,O"
1,"Specifically , this system is designed to deterministically choose between pronominalization , superordinate substitution , and definite noun phrase reiteration .","O,O,O,B,O,O,O,O,O,O,B,O,B,I,O,O,B,I,I,I,O"
2,The system identifies a strength of antecedence recovery for each of the lexical substitutions .,"O,B,O,O,O,O,B,I,O,O,O,O,B,I,O"
0,Image composition ( or mosaicing ) has attracted a growing attention in recent years as one of the main elements in video analysis and representation .,"B,I,I,I,I,I,O,O,O,O,O,O,O,O,O,O,O,O,O,O,O,B,I,I,I,O"
1,In this paper we deal with the problem of global alignment and super - resolution .,"O,O,O,O,O,O,O,O,O,B,I,O,B,I,I,O"
2,We also propose to evaluate the quality of the resulting mosaic by measuring the amount of blurring .,"O,O,O,O,O,O,O,O,O,O,B,O,O,O,B,I,I,O"
3,Global registration is achieved by combining a graph - based technique – that exploits the topological structure of the sequence induced by the spatial overlap – with a bundle adjustment which uses only the homographies computed in the previous steps .,"B,I,O,O,O,O,O,B,I,I,I,O,O,O,O,B,I,O,O,O,O,O,O,B,I,O,O,O,B,I,O,O,O,O,B,O,O,O,O,O,O"
4,Experimental comparison with other techniques shows the effectiveness of our approach .,"O,O,O,O,B,O,O,O,O,O,B,O"
0,We describe a method for identifying systematic patterns in translation data using part - of - speech tag sequences .,"O,O,O,B,O,O,B,I,I,I,I,O,B,I,I,I,I,I,I,O"
1,"We incorporate this analysis into a diagnostic tool intended for developers of machine translation systems , and demonstrate how our application can be used by developers to explore patterns in machine translation output .","O,O,O,B,O,O,B,I,O,O,O,O,B,I,I,O,O,O,O,O,B,O,O,O,O,O,O,O,B,I,I,I,I,O"
0,We directly investigate a subject of much recent debate : do word sense disambigation models help statistical machine translation quality ?,"O,O,O,O,O,O,O,O,O,O,O,B,I,I,I,O,B,I,I,I,O"
1,"We present empirical results casting doubt on this common , but unproved , assumption .","O,O,O,O,O,O,O,O,O,O,O,O,O,O,O"
2,"Using a state - of - the - art Chinese word sense disambiguation model to choose translation candidates for a typical IBM statistical MT system , we find that word sense disambiguation does not yield significantly better translation quality than the statistical machine translation system alone .","O,O,O,O,O,O,O,O,O,B,I,I,I,I,O,O,B,I,O,O,O,B,I,I,I,O,O,O,O,B,I,I,O,O,O,O,O,B,I,O,O,B,I,I,I,O,O"
3,"Error analysis suggests several key factors behind this surprising finding , including inherent limitations of current statistical MT architectures .","B,I,O,O,O,O,O,O,O,O,O,O,O,O,O,O,B,I,I,O"
0,Previous work has used monolingual parallel corpora to extract and generate paraphrases .,"O,O,O,O,B,I,I,O,O,O,O,B,O"
1,"We show that this task can be done using bilingual parallel corpora , a much more commonly available resource .","O,O,O,O,B,O,O,O,O,B,I,I,O,O,O,O,O,O,O,O"
2,"Using alignment techniques from phrase - based statistical machine translation , we show how paraphrases in one language can be identified using a phrase in another language as a pivot .","O,B,I,O,B,I,I,I,I,I,O,O,O,O,B,O,O,O,O,O,O,O,O,O,O,O,O,O,O,O,O"
3,"We define a paraphrase probability that allows paraphrases extracted from a bilingual parallel corpus to be ranked using translation probabilities , and show how it can be refined to take contextual information into account .","O,O,O,B,I,O,O,B,O,O,O,B,I,I,O,O,O,O,B,I,O,O,O,O,B,O,O,O,O,O,B,I,O,O,O"
4,"We evaluate our paraphrase extraction and ranking methods using a set of manual word alignments , and contrast the quality with paraphrases extracted from automatic alignments .","O,O,O,B,I,I,I,I,O,O,O,O,B,I,I,O,O,O,O,B,O,B,O,O,B,I,O"
0,"We derive a convex optimization problem for the task of segmenting sequential data , which explicitly treats presence of outliers .","O,O,O,B,I,I,O,O,O,O,B,I,I,O,O,O,O,O,O,B,O"
1,"We describe two algorithms for solving this problem , one exact and one a top - down novel approach , and we derive a consistency results for the case of two segments and no outliers .","O,O,O,B,O,O,O,B,O,O,O,O,O,O,O,O,O,O,O,O,O,O,O,O,O,O,O,O,O,O,O,O,O,O,O,O"
2,Robustness to outliers is evaluated on two real - world tasks related to speech segmentation .,"B,O,B,O,O,O,O,B,I,I,I,O,O,B,I,O"
3,Our algorithms outperform baseline seg - mentation algorithms .,"O,B,O,B,I,I,I,I,O"
0,This paper presents a novel statistical singing voice conversion ( SVC ) technique with direct waveform modification based on the spectrum differential that can convert voice timbre of a source singer into that of a target singer without using a vocoder to generate converted singing voice waveforms .,"O,O,O,O,O,B,I,I,I,I,I,I,I,O,B,I,I,O,O,O,B,I,O,O,O,B,I,O,O,O,O,O,O,O,O,O,O,O,O,O,B,O,O,B,I,I,I,O"
1,SVC makes it possible to convert singing voice characteristics of an arbitrary source singer into those of an arbitrary target singer .,"B,O,O,O,O,O,B,I,I,O,O,O,O,O,O,O,O,O,O,O,O,O"
2,"However , speech quality of the converted singing voice is significantly degraded compared to that of a natural singing voice due to various factors , such as analysis and modeling errors in the vocoder - based framework .","O,O,B,I,O,O,B,I,I,O,O,O,O,O,O,O,O,B,I,I,O,O,O,O,O,O,O,O,O,O,O,O,O,B,I,I,I,O"
3,"To alleviate this degradation , we propose a statistical conversion process that directly modifies the signal in the waveform domain by estimating the difference in the spectra of the source and target singers ' singing voices .","O,O,O,O,O,O,O,O,B,I,I,O,O,O,O,O,O,O,O,O,O,O,O,O,O,O,B,O,O,O,O,O,O,O,O,O,O"
4,The differential spectral feature is directly estimated using a differential Gaussian mixture model ( GMM ) that is analytically derived from the traditional GMM used as a conversion model in the conventional SVC .,"O,B,I,I,O,O,O,O,O,B,I,I,I,I,I,I,O,O,O,O,O,O,O,B,O,O,O,B,I,O,O,O,B,O"
5,The experimental results demonstrate that the proposed method makes it possible to significantly improve speech quality in the converted singing voice while preserving the conversion accuracy of singer identity compared to the conventional SVC .,"O,O,O,O,O,O,O,B,O,O,O,O,O,O,B,I,O,O,O,O,O,O,O,O,B,I,I,I,I,O,O,O,O,B,O"
0,"In this paper we present a statistical profile of the Named Entity task , a specific information extraction task for which corpora in several languages are available .","O,O,O,O,O,O,B,I,O,O,B,I,I,O,O,O,B,I,I,O,O,O,O,O,O,O,O,O"
1,"Using the results of the statistical analysis , we propose an algorithm for lower bound estimation for Named Entity corpora and discuss the significance of the cross - lingual comparisons provided by the analysis .","O,O,O,O,O,B,I,O,O,O,O,B,O,B,I,I,O,B,I,I,O,O,O,O,O,O,O,O,O,O,O,O,O,B,O"
0,"Motivated by the success of ensemble methods in machine learning and other areas of natural language processing , we developed a multi - strategy and multi - source approach to question answering which is based on combining the results from different answering agents searching for answers in multiple corpora .","O,O,O,O,O,B,I,O,B,I,O,O,O,O,B,I,I,O,O,O,O,B,I,I,I,I,I,I,I,O,B,I,O,O,O,O,O,O,O,O,O,B,I,O,O,O,O,O,O,O"
1,"The answering agents adopt fundamentally different strategies , one utilizing primarily knowledge - based mechanisms and the other adopting statistical techniques .","O,B,I,O,O,O,B,O,B,O,O,B,I,I,I,O,O,B,O,B,I,O"
2,"We present our multi - level answer resolution algorithm that combines results from the answering agents at the question , passage , and/or answer levels .","O,O,O,B,I,I,I,I,I,O,O,O,O,O,B,I,O,O,B,I,I,I,I,I,I,O"
3,"Experiments evaluating the effectiveness of our answer resolution algorithm show a 35.0 % relative improvement over our baseline system in the number of questions correctly answered , and a 32.8 % improvement according to the average precision metric .","O,O,O,O,O,O,B,I,I,O,O,O,O,O,O,O,O,B,I,O,O,O,O,O,O,O,O,O,O,O,O,O,O,O,O,B,I,I,O"
0,This paper proposes the Hierarchical Directed Acyclic Graph ( HDAG ) Kernel for structured natural language data .,"O,O,O,O,B,I,I,I,I,I,I,I,O,B,I,I,I,O"
1,"The HDAG Kernel directly accepts several levels of both chunks and their relations , and then efficiently computes the weighed sum of the number of common attribute sequences of the HDAGs .","O,B,I,O,O,O,O,O,O,O,O,O,O,O,O,O,O,O,O,O,O,O,O,O,O,O,O,O,O,O,B,O"
2,We applied the proposed method to question classification and sentence alignment tasks to evaluate its performance as a similarity measure and a kernel function .,"O,O,O,O,B,O,B,I,I,I,I,I,O,O,O,O,O,O,B,I,O,O,B,I,O"
3,The results of the experiments demonstrate that the HDAG Kernel is superior to other kernel functions and baseline methods .,"O,O,O,O,O,O,O,O,B,I,O,O,O,O,B,I,O,B,I,O"
0,In the security domain a key problem is identifying rare behaviours of interest .,"O,O,B,I,O,O,O,O,B,B,I,I,I,O"
1,"Training examples for these behaviours may or may not exist , and if they do exist there will be few examples , quite probably one .","B,I,O,O,B,O,O,O,O,O,O,O,O,B,O,O,O,O,O,O,O,O,O,O,O,O"
2,We present a novel weakly supervised algorithm that can detect behaviours that either have never before been seen or for which there are few examples .,"O,O,O,O,B,I,I,O,O,O,B,O,O,O,O,O,O,O,O,O,O,O,O,O,O,O"
3,"Global context is modelled , allowing the detection of abnormal behaviours that in isolation appear normal .","B,I,O,O,O,O,O,B,I,I,I,O,O,O,O,O,O"
4,"Pragmatic aspects are considered , such that no parameter tuning is required and real time performance is achieved .","B,I,O,O,O,O,O,O,B,I,O,O,O,O,O,O,O,O,O"
0,We present a text mining method for finding synonymous expressions based on the distributional hypothesis in a set of coherent corpora .,"O,O,O,B,I,I,O,O,B,I,O,O,O,B,I,O,O,O,O,O,O,O"
1,This paper proposes a new methodology to improve the accuracy of a term aggregation system using each author 's text as a coherent corpus .,"O,O,O,O,O,B,O,O,O,B,O,O,B,I,I,O,O,O,O,O,O,O,O,O,O"
2,Our approach is based on the idea that one person tends to use one expression for one meaning .,"O,B,O,O,O,O,O,O,O,O,O,O,O,O,O,O,O,O,O"
3,"According to our assumption , most of the words with similar context features in each author 's corpus tend not to be synonymous expressions .","O,O,O,O,O,O,O,O,O,O,B,I,I,O,O,O,O,O,O,O,O,O,B,I,O"
4,"Our proposed method improves the accuracy of our term aggregation system , showing that our approach is successful .","O,O,B,O,O,B,O,O,B,I,I,O,O,O,O,B,O,O,O"
0,We propose a detection method for orthographic variants caused by transliteration in a large corpus .,"O,O,O,B,I,O,B,I,O,O,B,O,O,O,O,O"
1,The method employs two similarities .,"O,B,O,O,B,O"
2,One is string similarity based on edit distance .,"O,O,B,I,O,O,B,I,O"
3,The other is contextual similarity by a vector space model .,"O,O,O,B,I,O,O,B,I,I,O"
4,Experimental results show that the method performed a 0.889 F - measure in an open test .,"O,O,O,O,O,B,O,O,O,B,I,I,O,O,O,O,O"
0,"Techniques for automatically training modules of a natural language generator have recently been proposed , but a fundamental concern is whether the quality of utterances produced with trainable components can compete with hand - crafted template - based or rule - based approaches .","B,O,B,I,I,O,O,B,I,I,O,O,O,O,O,O,O,O,O,O,O,O,B,I,B,O,O,B,I,O,O,O,B,I,I,I,I,I,I,I,I,I,I,O"
1,In this paper We experimentally evaluate a trainable sentence planner for a spoken dialogue system by eliciting subjective human judgments .,"O,O,O,O,O,O,O,B,I,I,O,O,B,I,I,O,O,B,I,I,O"
2,"In order to perform an exhaustive comparison , we also evaluate a hand - crafted template - based generation component , two rule - based sentence planners , and two baseline sentence planners .","O,O,O,O,O,O,O,O,O,O,O,O,B,I,I,I,I,I,I,I,O,O,B,I,I,I,I,O,O,O,B,I,I,O"
3,"We show that the trainable sentence planner performs better than the rule - based systems and the baselines , and as well as the hand - crafted system .","O,O,O,O,B,I,I,O,O,O,O,B,I,I,I,O,O,B,O,O,O,O,O,O,B,I,I,I,O"
0,"Using natural language processing , we carried out a trend survey on Japanese natural language processing studies that have been done over the last ten years .","O,B,I,I,O,O,O,O,O,B,I,I,B,I,I,I,I,O,O,O,O,O,O,O,O,O,O"
1,We determined the changes in the number of papers published for each research organization and on each research area as well as the relationship between research organizations and research areas .,"O,O,O,O,O,O,O,O,O,O,O,O,O,O,O,O,O,O,O,O,O,O,O,O,O,O,O,O,O,O,O"
2,This paper is useful for both recognizing trends in Japanese NLP and constructing a method of supporting trend surveys using NLP .,"O,O,O,O,O,O,O,O,O,B,I,O,O,O,O,O,O,B,I,O,B,O"
0,"While sentence extraction as an approach to summarization has been shown to work in documents of certain genres , because of the conversational nature of email communication where utterances are made in relation to one made previously , sentence extraction may not capture the necessary segments of dialogue that would make a summary coherent .","O,B,I,O,O,O,O,B,O,O,O,O,O,O,O,O,O,O,O,O,O,O,O,O,O,B,I,O,O,O,O,O,O,O,O,O,O,O,B,I,O,O,O,O,O,O,O,O,O,O,O,O,O,O,O"
1,"In this paper , we present our work on the detection of question - answer pairs in an email conversation for the task of email summarization .","O,O,O,O,O,O,O,O,O,O,B,I,I,I,I,I,O,O,B,I,O,O,O,O,B,I,O"
