,sentence,word_labels
4,"We show that SHORTSTR2 is complementary to the existing algorithms SHORTGAC and HAGGISGAC that exploit short supports , while being much simpler .","O,O,O,B,O,O,O,O,O,O,B,O,B,O,O,O,O,O,O,O,O,O,O"
5,"When a constraint is amenable to short supports , the short support set can be exponentially smaller than the full - length support set .","O,O,B,O,O,O,B,I,O,O,B,I,I,O,O,O,O,O,O,B,I,I,I,I,O"
6,Therefore SHORTSTR2 can efficiently propagate many constraints that STR2 + can not even load into memory .,"O,B,O,O,O,O,B,O,B,I,O,O,O,O,O,O,O"
7,"We also show that SHORTSTR2 can be combined with a simple algorithm to identify short supports from full - length supports , to provide a superior drop - in replacement for STR2 + .","O,O,O,O,B,O,O,O,O,O,O,B,O,O,B,I,O,B,I,I,I,O,O,O,O,O,B,I,I,I,O,B,I,O"
0,"The JAVELIN system integrates a flexible , planning - based architecture with a variety of language processing modules to provide an open - domain question answering capability on free text .","O,B,I,O,O,O,O,B,I,I,I,O,O,O,O,B,I,I,O,O,O,B,I,I,I,I,I,O,O,O,O"
1,The demonstration will focus on how JAVELIN processes questions and retrieves the most likely answer candidates from the given text corpus .,"O,O,O,O,O,O,B,O,O,O,O,O,O,O,O,O,O,O,O,O,O,O"
2,The operation of the system will be explained in depth through browsing the repository of data objects created by the system during each question answering session .,"O,O,O,O,B,O,O,O,O,O,O,O,O,O,O,O,O,O,O,O,B,O,O,B,I,O,O"
0,"The TAP - XL Automated Analyst 's Assistant is an application designed to help an English -speaking analyst write a topical report , culling information from a large inflow of multilingual , multimedia data .","O,B,I,I,I,I,I,I,O,O,O,O,O,O,O,O,O,O,O,O,O,O,O,O,O,O,O,O,O,O,B,I,I,I,O"
1,"It gives users the ability to spend their time finding more data relevant to their task , and gives them translingual reach into other languages by leveraging human language technology .","B,O,O,O,O,O,O,O,O,O,O,O,O,O,O,O,O,O,O,O,O,O,O,O,O,O,O,B,I,I,O"
0,""" To explain complex phenomena , an explanation system must be able to select information from a formal representation of domain knowledge , organize the selected information into multisentential discourse plans , and realize the discourse plans in text .","O,O,O,O,O,O,O,B,I,O,O,O,O,O,O,O,O,O,O,O,O,O,O,O,O,O,O,O,B,I,I,O,O,O,O,B,I,O,O,O"
1,"Although recent years have witnessed significant progress in the development of sophisticated computational mechanisms for explanation , empirical results have been limited .","O,O,O,O,O,O,O,O,O,O,O,O,O,O,O,O,O,O,O,O,O,O,O"
2,"This paper reports on a seven - year effort to empirically study explanation generation from semantically rich , large - scale knowledge bases .","O,O,O,O,O,O,O,O,O,O,O,O,B,I,O,B,I,I,I,I,I,I,I,O"
3,"In particular , it describes a robust explanation system that constructs multisentential and multi - paragraph explanations from the a large - scale knowledge base in the domain of botanical anatomy , physiology , and development .","O,O,O,O,O,O,B,I,I,O,O,B,I,I,I,I,I,O,O,O,B,I,I,I,I,O,O,O,O,B,I,O,B,O,O,B,O"
4,We introduce the evaluation methodology and describe how performance was assessed with this methodology in the most extensive empirical evaluation conducted on an explanation system .,"O,O,O,B,I,O,O,O,O,O,O,O,O,B,O,O,O,O,O,O,O,O,O,B,I,O"
5,"In this evaluation , scored within "" "" half a grade "" "" of domain experts , and its performance exceeded that of one of the domain experts . ""","O,O,B,O,O,O,O,O,O,O,O,O,O,O,O,O,O,O,O,O,O,O,O,O,O,O,O,O,O,O"
0,"This paper presents an analysis of temporal anaphora in sentences which contain quantification over events , within the framework of Discourse Representation Theory .","O,O,O,O,O,O,B,I,O,O,O,O,B,I,I,O,O,O,O,O,B,I,I,O"
1,"The analysis in ( Partee , 1984 ) of quantified sentences , introduced by a temporal connective , gives the wrong truth - conditions when the temporal connective in the subordinate clause is before or after .","O,O,O,O,O,O,O,O,O,B,I,O,O,O,O,B,I,O,O,O,O,O,O,O,O,O,B,I,O,O,B,I,O,O,O,O,O"
2,"This problem has been previously analyzed in ( de Swart , 1991 ) as an instance of the proportion problem and given a solution from a Generalized Quantifier approach .","O,B,O,O,O,O,O,O,O,O,O,O,O,O,O,O,O,O,B,I,O,O,O,B,O,O,B,I,I,O"
3,"By using a careful distinction between the different notions of reference time based on ( Kamp and Reyle , 1993 ) , we propose a solution to this problem , within the framework of DRT .","O,O,O,O,O,O,O,O,O,O,B,I,O,O,O,O,O,O,O,O,O,O,O,O,O,B,O,O,B,O,O,O,O,O,B,O"
4,We show some applications of this solution to additional temporal anaphora phenomena in quantified sentences .,"O,O,O,O,O,O,B,O,O,B,I,I,O,B,I,O"
0,We investigated whether automatic phonetic transcriptions ( APTs ) can replace manually verified phonetic transcriptions ( MPTs ) in a large corpus - based study on pronunciation variation .,"O,O,O,B,I,I,I,I,I,O,O,B,I,I,I,O,O,O,O,O,O,O,O,O,O,O,B,I,O"
1,"To this end , we compared the performance of both transcription types in a classification experiment aimed at establishing the direct influence of a particular situational setting on pronunciation variation .","O,O,O,O,O,O,O,O,O,O,O,O,O,O,B,O,O,O,O,O,O,O,O,O,O,O,O,O,B,I,O"
2,We trained classifiers on the speech processes extracted from the alignments of an APT and an MPT with a canonical transcription .,"O,O,B,O,O,B,I,O,O,O,B,O,O,B,O,O,B,O,O,B,I,O"
3,"We tested whether the classifiers were equally good at verifying whether unknown transcriptions represent read speech or telephone dialogues , and whether the same speech processes were identified to distinguish between transcriptions of the two situational settings .","O,O,O,O,B,O,O,O,O,O,O,B,I,O,B,I,O,B,I,O,O,O,O,O,B,I,O,O,O,O,O,O,O,O,O,O,O,O"
4,Our results not only show that similar distinguishing speech processes were identified ; our APT - based classifier yielded better classification accuracy than the MPT - based classifier whilst using fewer classification features .,"O,O,O,O,O,O,O,O,O,O,O,O,O,O,B,I,I,I,O,O,B,I,O,O,B,I,I,I,O,O,O,B,I,O"
0,Previous research has demonstrated the utility of clustering in inducing semantic verb classes from undisambiguated corpus data .,"O,O,O,O,O,O,O,B,O,B,I,I,I,O,B,I,I,O"
1,We describe a new approach which involves clustering subcategorization frame ( SCF ) distributions using the Information Bottleneck and nearest neighbour methods .,"O,O,O,O,B,O,O,B,I,I,I,I,I,I,O,O,B,I,I,I,I,I,O"
2,"In contrast to previous work , we particularly focus on clustering polysemic verbs .","O,O,O,O,O,O,O,O,O,O,B,B,I,O"
3,"A novel evaluation scheme is proposed which accounts for the effect of polysemy on the clusters , offering us a good insight into the potential and limitations of semantically classifying undisambiguated SCF data .","O,O,B,I,O,O,O,O,O,O,O,O,B,O,O,B,O,O,O,O,O,O,O,O,O,O,O,O,B,I,I,I,I,O"
0,We present results on addressee identification in four - participants face - to - face meetings using Bayesian Network and Naive Bayes classifiers .,"O,O,O,O,B,I,I,I,I,I,I,I,I,I,I,I,O,B,I,O,B,I,I,O"
1,"First , we investigate how well the addressee of a dialogue act can be predicted based on gaze , utterance and conversational context features .","O,O,O,O,O,O,O,B,I,I,I,I,O,O,O,O,O,B,O,B,O,B,I,I,O"
2,"Then , we explore whether information about meeting context can aid classifiers ' performances .","O,O,O,O,O,O,O,B,I,O,O,B,O,O,O"
3,Both classifiers perform the best when conversational context and utterance features are combined with speaker 's gaze information .,"O,B,O,O,O,O,B,I,O,B,I,O,O,O,B,I,I,I,O"
4,The classifiers show little gain from information about meeting context .,"O,B,O,O,O,O,O,O,B,I,O"
0,The introduction of prior knowledge has greatly enhanced numerous purely low - level driven image processing algorithms .,"O,O,O,B,I,O,O,O,O,O,B,I,I,I,I,I,I,O"
1,"In this work , we focus on the problem of non - rigid image registration .","O,O,O,O,O,O,O,O,O,O,B,I,I,I,I,O"
2,"A number of powerful registration criteria have been developed in the last decade , most prominently the criterion of maximum mutual information .","O,O,O,O,B,I,O,O,O,O,O,O,O,O,O,O,O,O,O,B,I,I,O"
3,"Although this criterion provides for good registration results in many applications , it remains a purely low - level criterion .","O,O,B,O,O,O,O,O,O,O,O,O,B,O,O,O,B,I,I,I,O"
4,"As a consequence , registration results will deteriorate once this low - level information is corrupted , due to noise , partial occlusions or missing image structure .","O,O,O,O,B,O,O,O,O,O,B,I,I,I,O,O,O,O,O,B,O,B,I,O,B,I,I,O"
5,"In this paper , we will develop a Bayesian framework that allows to impose statistically learned prior knowledge about the joint intensity distribution into image registration methods .","O,O,O,O,O,O,O,O,B,I,O,O,O,O,B,I,I,I,O,O,B,I,I,O,B,I,I,O"
6,The prior is given by a kernel density estimate on the space of joint intensity distributions computed from a representative set of pre - registered image pairs .,"O,B,O,O,O,O,B,I,I,O,O,O,O,B,I,I,O,O,O,O,O,O,B,I,I,I,I,O"
7,This nonparametric prior accurately models previously learned intensity relations between various image modalities and slice locations .,"O,O,O,O,O,O,O,B,I,O,O,B,I,O,B,I,O"
8,Experimental results demonstrate that the resulting registration process is more robust to missing low - level information as it favors intensity correspondences statistically consistent with the learned intensity distributions .,"O,O,O,O,O,O,B,I,O,O,O,O,B,I,I,I,I,O,B,O,B,I,O,O,O,O,O,B,I,O"
0,In this paper a morphological component with a limited capability to automatically interpret ( and generate ) derived words is presented .,"O,O,O,O,B,I,O,O,O,O,O,O,O,O,O,O,O,B,I,O,O,O"
1,"The system combines an extended two - level morphology [ Trost , 1991a ; Trost , 1991b ] with a feature - based word grammar building on a hierarchical lexicon .","O,B,O,O,O,B,I,I,I,O,O,O,O,O,O,O,O,O,O,O,B,I,I,I,I,O,O,O,B,I,O"
2,Polymorphemic stems not explicitly stored in the lexicon are given a compositional interpretation .,"B,I,O,O,O,O,O,O,O,O,O,B,I,O"
3,That way the system allows to minimize redundancy in the lexicon because derived words that are transparent need not to be stored explicitly .,"O,O,O,B,O,O,O,O,O,O,O,O,B,I,O,O,O,O,O,O,O,O,O,O"
4,"Also , words formed ad - hoc can be recognized correctly .","O,O,B,I,I,I,I,O,O,O,O,O"
5,The system is implemented in CommonLisp and has been tested on examples from German derivation .,"O,B,O,O,O,B,O,O,O,O,O,O,O,B,I,O"
0,The interlingual approach to MT has been repeatedly advocated by researchers originally interested in natural language understanding who take machine translation to be one possible application .,"O,B,I,O,B,O,O,O,O,O,O,O,O,O,B,I,I,O,O,B,I,O,O,O,O,O,O"
1,"However , not only the ambiguity but also the vagueness which every natural language inevitably has leads this approach into essential difficulties .","O,O,O,O,O,O,O,O,O,O,O,O,O,O,O,O,O,O,O,O,O,O,O"
2,"In contrast , our project , the Mu - project , adopts the transfer approach as the basic framework of MT .","O,O,O,O,O,O,O,B,I,I,O,O,O,B,I,O,O,O,O,O,B,O"
3,"This paper describes the detailed construction of the transfer phase of our system from Japanese to English , and gives some examples of problems which seem difficult to treat in the interlingual approach .","O,O,O,O,O,O,O,O,B,I,O,O,B,O,B,O,B,O,O,O,O,O,O,O,O,O,O,O,O,O,O,B,I,O"
4,The basic design principles of the transfer phase of our system have already been mentioned in ( 1 ) ( 2 ) .,"O,O,O,O,O,O,B,I,O,O,B,O,O,O,O,O,O,O,O,O,O,O,O"
5,Some of the principles which are relevant to the topic of this paper are : ( a ) Multiple Layer of Grammars ( b ) Multiple Layer Presentation ( c ) Lexicon Driven Processing ( d ) Form - Oriented Dictionary Description .,"O,O,O,B,O,O,O,O,O,O,O,O,O,O,O,O,O,O,B,I,I,I,O,O,O,B,I,I,O,O,O,B,I,I,O,O,O,B,I,I,I,I,O"
6,This paper also shows how these principles are realized in the current system .,"O,O,O,O,O,O,B,O,O,O,O,O,B,O"
0,"In this paper , we propose a human action recognition system suitable for embedded computer vision applications in security systems , human - computer interaction and intelligent environments .","O,O,O,O,O,O,O,B,I,I,I,O,O,B,I,I,I,O,B,I,O,B,I,I,I,O,B,I,O"
1,Our system is suitable for embedded computer vision application based on three reasons .,"O,B,O,O,O,B,I,I,I,O,O,O,O,O"
2,"Firstly , the system was based on a linear Support Vector Machine ( SVM ) classifier where classification progress can be implemented easily and quickly in embedded hardware .","O,O,O,B,O,O,O,O,B,I,I,I,I,I,I,I,O,B,I,O,O,O,O,O,O,O,B,I,O"
3,"Secondly , we use compacted motion features easily obtained from videos .","O,O,O,O,B,I,I,O,O,O,B,O"
4,We address the limitations of the well known Motion History Image ( MHI ) and propose a new Hierarchical Motion History Histogram ( HMHH ) feature to represent the motion information .,"O,O,O,O,O,O,O,O,B,I,I,I,I,I,O,O,O,O,B,I,I,I,I,I,I,I,O,O,O,B,I,O"
5,"HMHH not only provides rich motion information , but also remains computationally inexpensive .","B,O,O,O,B,I,I,O,O,O,O,O,O,O"
6,"Finally , we combine MHI and HMHH together and extract a low dimension feature vector to be used in the SVM classifiers .","O,O,O,O,B,O,B,O,O,O,O,B,I,I,I,O,O,O,O,O,B,I,O"
7,Experimental results show that our system achieves significant improvement on the recognition performance .,"O,O,O,O,O,B,O,O,O,O,O,B,O,O"
0,We present a novel approach for automatically acquiring English topic signatures .,"O,O,O,O,B,O,B,I,I,I,I,O"
1,"Given a particular concept , or word sense , a topic signature is a set of words that tend to co - occur with it .","O,O,O,B,O,O,B,I,O,O,B,I,O,O,O,O,O,O,O,O,O,O,O,O,O,O"
2,"Topic signatures can be useful in a number of Natural Language Processing ( NLP ) applications , such as Word Sense Disambiguation ( WSD ) and Text Summarisation .","B,I,O,O,O,O,O,O,O,B,I,I,I,I,I,I,O,O,O,B,I,I,I,I,I,O,B,I,O"
3,"Our method takes advantage of the different way in which word senses are lexicalised in English and Chinese , and also exploits the large amount of Chinese text available in corpora and on the Web .","O,B,O,O,O,O,O,O,O,O,B,I,O,O,O,B,O,B,O,O,O,O,O,O,O,O,B,I,O,O,B,O,O,O,B,O"
4,"We evaluated the topic signatures on a WSD task , where we trained a second - order vector cooccurrence algorithm on standard WSD datasets , with promising results .","O,O,O,B,I,O,O,B,I,O,O,O,O,O,B,I,I,I,I,I,O,O,B,I,O,O,O,O,O"
0,This paper concerns the discourse understanding process in spoken dialogue systems .,"O,O,O,O,B,I,I,O,B,I,I,O"
1,This process enables the system to understand user utterances based on the context of a dialogue .,"O,O,O,O,B,O,O,B,I,O,O,O,O,O,O,O,O"
2,"Since multiple candidates for the understanding result can be obtained for a user utterance due to the ambiguity of speech understanding , it is not appropriate to decide on a single understanding result after each user utterance .","O,O,O,O,O,O,O,O,O,O,O,O,B,I,O,O,O,B,I,I,I,O,O,O,O,O,O,O,O,O,O,O,O,O,O,B,I,O"
3,"By holding multiple candidates for understanding results and resolving the ambiguity as the dialogue progresses , the discourse understanding accuracy can be improved .","O,O,O,O,O,O,O,O,O,O,B,O,O,O,O,O,O,B,I,I,O,O,O,O"
4,This paper proposes a method for resolving this ambiguity based on statistical information obtained from dialogue corpora .,"O,O,O,O,B,O,O,O,B,O,O,B,I,O,O,B,I,O"
5,"Unlike conventional methods that use hand - crafted rules , the proposed method enables easy design of the discourse understanding process .","O,O,B,O,O,B,I,I,I,O,O,O,B,O,O,O,O,O,B,I,I,O"
6,Experiment results have shown that a system that exploits the proposed method performs sufficiently and that holding multiple candidates for understanding results is effective .,"O,O,O,O,O,O,B,O,O,O,O,B,O,O,O,O,O,O,O,O,O,O,O,O,O"
0,GLOSSER is designed to support reading and learning to read in a foreign language .,"B,O,O,O,O,B,I,I,O,O,O,O,O,O,O"
1,"There are four language pairs currently supported by GLOSSER : English - Bulgarian , English - Estonian , English - Hungarian and French - Dutch .","O,O,O,B,I,O,O,O,B,O,B,I,I,O,B,I,I,O,B,I,I,O,B,I,I,O"
2,"The program is operational on UNIX and Windows ' 95 platforms , and has undergone a pilot user - study .","O,B,O,O,O,B,I,I,I,I,I,O,O,O,O,O,O,B,I,I,O"
3,"A demonstration ( in UNIX ) for Applied Natural Language Processing emphasizes components put to novel technical uses in intelligent computer - assisted morphological analysis ( ICALL ) , including disambiguated morphological analysis and lemmatized indexing for an aligned bilingual corpus of word examples .","O,O,O,O,O,O,O,B,I,I,I,O,B,O,O,O,O,O,O,B,I,I,I,I,I,I,I,I,O,O,B,I,I,O,B,I,O,O,B,I,I,O,O,O,O"
0,Combination methods are an effective way of improving system performance .,"B,I,O,O,O,O,O,O,O,O,O"
1,This paper examines the benefits of system combination for unsupervised WSD .,"O,O,O,O,O,O,B,I,O,B,I,O"
2,We investigate several voting- and arbiter - based combination strategies over a diverse pool of unsupervised WSD systems .,"O,O,O,B,I,I,I,I,I,I,O,O,O,O,O,B,I,I,O"
3,Our combination methods rely on predominant senses which are derived automatically from raw text .,"O,B,I,O,O,B,I,O,O,O,O,O,B,I,O"
4,Experiments using the SemCor and Senseval-3 data sets demonstrate that our ensembles yield significantly better results when compared with state - of - the - art .,"O,O,O,B,I,I,I,I,O,O,O,B,O,O,O,O,O,O,O,B,I,I,I,I,I,I,O"
0,"In this paper , we introduce a generative probabilistic optical character recognition ( OCR ) model that describes an end - to - end process in the noisy channel framework , progressing from generation of true text through its transformation into the noisy output of an OCR system .","O,O,O,O,O,O,O,B,I,I,I,I,I,I,I,I,O,O,O,O,O,O,O,O,O,O,O,B,I,I,O,O,O,O,O,O,O,O,O,O,O,O,O,O,O,O,B,I,O"
1,"The model is designed for use in error correction , with a focus on post - processing the output of black - box OCR systems in order to make it more useful for NLP tasks .","O,B,O,O,O,O,O,B,I,O,O,O,O,O,B,I,I,O,B,I,I,I,I,B,I,O,O,O,O,B,O,O,O,B,I,O"
2,"We present an implementation of the model based on finite - state models , demonstrate the model 's ability to significantly reduce character and word error rate , and provide evaluation results involving automatic extraction of translation lexicons from printed text .","O,O,O,O,O,O,B,O,O,B,I,I,I,O,O,O,B,O,O,O,O,O,B,I,I,I,I,O,O,O,O,O,O,B,I,I,I,I,O,B,I,O"
0,"In this paper , we improve an unsupervised learning method using the Expectation - Maximization ( EM ) algorithm proposed by Nigam et al .","O,O,O,O,O,O,O,B,I,I,O,O,B,I,I,I,I,I,I,O,O,O,O,O,O"
1,for text classification problems in order to apply it to word sense disambiguation ( WSD ) problems .,"O,B,I,I,O,O,O,O,B,O,B,I,I,I,I,I,I,O"
2,The improved method stops the EM algorithm at the optimum iteration number .,"O,O,B,O,O,B,I,O,O,B,I,I,O"
3,"To estimate that number , we propose two methods .","O,O,O,B,O,O,O,O,O,O"
4,"In experiments , we solved 50 noun WSD problems in the Japanese Dictionary Task in SENSEVAL2 .","O,O,O,O,O,O,B,I,I,O,O,B,I,I,O,B,O"
5,The score of our method is a match for the best public score of this task .,"O,O,O,O,B,O,O,O,O,O,O,O,O,O,O,B,O"
6,"Furthermore , our methods were confirmed to be effective also for verb WSD problems .","O,O,O,B,O,O,O,O,O,O,O,B,I,I,O"
0,"The co - occurrence pattern , a combination of binary or local features , is more discriminative than individual features and has shown its advantages in object , scene , and action recognition .","O,B,I,I,I,O,O,O,O,B,I,I,I,O,O,O,O,O,O,O,O,O,O,O,O,O,B,I,I,I,I,I,I,O"
1,"We discuss two types of co - occurrence patterns that are complementary to each other , the conjunction ( AND ) and disjunction ( OR ) of binary features .","O,O,O,O,O,B,I,I,I,O,O,O,O,O,O,O,O,B,I,I,I,I,I,I,I,I,I,I,I,O"
2,The necessary condition of identifying discriminative co - occurrence patterns is firstly provided .,"O,O,O,O,B,B,I,I,I,I,O,O,O,O"
3,"Then we propose a novel data mining method to efficiently discover the optimal co - occurrence pattern with minimum empirical error , despite the noisy training dataset .","O,O,O,O,O,B,I,I,O,O,O,O,B,I,I,I,I,O,B,I,I,O,O,O,B,I,I,O"
4,"This mining procedure of AND and OR patterns is readily integrated to boosting , which improves the generalization ability over the conventional boosting decision trees and boosting decision stumps .","O,B,I,O,B,I,I,I,O,O,O,O,B,O,O,O,O,B,I,O,O,O,B,I,I,O,B,I,I,O"
5,"Our versatile experiments on object , scene , and action cat - egorization validate the advantages of the discovered dis - criminative co - occurrence patterns .","O,O,O,O,B,I,I,I,I,I,I,I,I,O,O,O,O,O,O,B,I,I,I,I,I,I,O"
0,In this paper we show how two standard outputs from information extraction ( IE ) systems - named entity annotations and scenario templates - can be used to enhance access to text collections via a standard text browser .,"O,O,O,O,O,O,O,O,B,O,B,I,I,I,I,I,O,B,I,I,O,B,I,O,O,O,O,O,O,O,O,B,I,O,O,O,B,I,O"
1,We describe how this information is used in a prototype system designed to support information workers ' access to a pharmaceutical news archive as part of their industry watch function .,"O,O,O,O,O,O,O,O,O,B,I,O,O,O,O,O,O,O,O,O,B,I,I,O,O,O,O,O,O,O,O"
2,"We also report results of a preliminary , qualitative user evaluation of the system , which while broadly positive indicates further work needs to be done on the interface to make users aware of the increased potential of IE - enhanced text browsers .","O,O,O,O,O,O,O,O,B,I,I,O,O,B,O,O,O,O,O,O,O,O,O,O,O,O,O,O,O,O,O,O,O,O,O,O,O,O,B,I,I,I,I,O"
0,Two main classes of approaches have been studied to perform monocular nonrigid 3D reconstruction : Template - based methods and Non - rigid Structure from Motion techniques .,"O,O,O,O,B,O,O,O,O,O,B,I,I,I,O,B,I,I,I,O,B,I,I,I,I,I,I,O"
1,"While the first ones have been applied to reconstruct poorly - textured surfaces , they assume the availability of a 3D shape model prior to reconstruction .","O,O,O,B,O,O,O,O,O,B,I,I,I,O,B,O,O,O,O,O,B,I,I,O,O,B,O"
2,"By contrast , the second ones do not require such a shape template , but , instead , rely on points being tracked throughout a video sequence , and are thus ill - suited to handle poorly - textured surfaces .","O,O,O,O,O,B,O,O,O,O,O,B,I,O,O,O,O,O,O,O,O,O,O,O,O,B,I,O,O,O,O,O,O,O,O,O,B,I,I,I,O"
3,"In this paper , we introduce a template - free approach to reconstructing a poorly - textured , deformable surface .","O,O,O,O,O,O,O,B,I,I,I,O,O,O,B,I,I,I,I,I,O"
4,"To this end , we leverage surface isometry and formulate 3D reconstruction as the joint problem of non - rigid image registration and depth estimation .","O,O,O,O,O,O,B,I,O,O,B,I,O,O,B,I,I,I,I,I,I,I,I,I,I,O"
5,Our experiments demonstrate that our approach yields much more accurate 3D reconstructions than state - of - the - art techniques .,"O,O,O,O,O,B,O,O,O,O,B,I,O,B,I,I,I,I,I,I,I,O"
0,Joint image filters can leverage the guidance image as a prior and transfer the structural details from the guidance image to the target image for suppressing noise or enhancing spatial resolution .,"B,I,I,O,O,O,B,I,O,O,O,O,O,O,O,O,O,O,B,I,O,O,O,O,O,B,I,O,B,I,I,O"
1,Existing methods rely on various kinds of explicit filter construction or hand - designed objective functions .,"B,I,O,O,O,O,O,B,I,I,O,B,I,I,I,I,O"
2,"It is thus difficult to understand , improve , and accelerate them in a coherent framework .","O,O,O,O,O,O,O,O,O,O,O,B,O,O,B,I,O"
3,"In this paper , we propose a learning - based approach to construct a joint filter based on Convolution - al Neural Networks .","O,O,O,O,O,O,O,B,I,I,I,O,O,O,B,I,O,O,B,I,I,I,I,O"
4,"In contrast to existing methods that consider only the guidance image , our method can selectively transfer salient structures that are consistent in both guidance and target images .","O,O,O,O,B,O,O,O,O,B,I,O,O,B,O,O,B,I,I,O,O,O,O,O,O,O,O,O,O"
5,"We show that the model trained on a certain type of data , e.g.","O,O,O,O,B,O,O,O,O,O,O,B,O,O"
6,", RGB and depth images , generalizes well for other modalities , e.g.","O,B,I,I,I,O,O,O,O,O,B,O,O"
7,", Flash / Non - Flash and RGB / NIR images .","O,B,I,I,I,I,I,I,I,I,I,O"
8,We validate the effectiveness of the proposed joint filter through extensive comparisons with state - of - the - art methods .,"O,O,O,O,O,O,O,B,I,O,O,O,O,B,I,I,I,I,I,I,I,O"
0,Soames 1979 provides some counterexamples to the theory of natural language presuppositions that is presented in Gazdar 1979 .,"O,O,O,O,O,O,O,O,O,B,I,I,O,O,O,O,O,O,O"
1,Soames 1982 provides a theory which explains these counterexamples .,"O,O,O,O,O,O,O,O,O,O"
2,Mercer 1987 rejects the solution found in Soames 1982 leaving these counterexamples unexplained .,"O,O,O,O,O,O,O,O,O,O,O,O,O,O"
3,"By reappraising these insightful counterexamples , the inferential theory for natural language presuppositions described in Mercer 1987 , 1988 gives a simple and straightforward explanation for the presuppositional nature of these sentences .","O,O,O,O,O,O,O,O,O,O,B,I,I,O,O,O,O,O,O,O,O,O,O,O,O,O,O,B,I,O,O,O,O"
0,"Along with the increasing requirements , the hash - tag recommendation task for microblogs has been receiving considerable attention in recent years .","O,O,O,O,O,O,O,B,I,I,I,I,O,B,O,O,O,O,O,O,O,O,O"
1,Various researchers have studied the problem from different aspects .,"O,O,O,O,O,O,O,O,O,O"
2,"However , most of these methods usually need handcrafted features .","O,O,O,O,O,O,O,O,B,I,O"
3,"Motivated by the successful use of convolutional neural networks ( CNNs ) for many natural language processing tasks , in this paper , we adopt CNNs to perform the hashtag recommendation problem .","O,O,O,O,O,O,B,I,I,I,I,I,O,O,B,I,I,I,O,O,O,O,O,O,O,B,O,O,O,B,I,I,O"
4,"To incorporate the trigger words whose effectiveness have been experimentally evaluated in several previous works , we propose a novel architecture with an attention mechanism .","O,O,O,B,I,O,O,O,O,O,O,O,O,O,O,O,O,O,O,O,B,O,O,B,I,O"
